{
  "schema_version": 1,
  "artifact_kind": "verification-command-plan",
  "plan_id": "aaaaaaaaaaaaaaaaaaaaaaaaaaaaaaaa",
  "created_at": "2026-08-22T10:00:00Z",
  "expires_at": "2026-08-22T10:30:00Z",
  "runner_id": "lizard-constrained-verifier-v1",
  "worktree_root": "/fixture/worktree",
  "worktree_identity_sha256": "bbbbbbbbbbbbbbbbbbbbbbbbbbbbbbbbbbbbbbbbbbbbbbbbbbbbbbbbbbbbbbbb",
  "executable": {
    "id": "git",
    "path": "/usr/bin/git",
    "sha256": "cccccccccccccccccccccccccccccccccccccccccccccccccccccccccccccccc"
  },
  "commands": [
    { "command_id": "git-head", "timeout_seconds": 30, "expected_exit_codes": [0] }
  ],
  "restrictions": {
    "shell": false,
    "network": "denied-by-command-allowlist",
    "working_directory": "worktree-root-only",
    "environment": "sanitized-minimal",
    "child_processes": "allowlisted-executable-only",
    "interactive": false,
    "output": "hash-and-size-only"
  }
}
